<?xml version="1.0" encoding="UTF-8"?>
<tns:package name="test.abc"
xmlns:xsi="http://www.w3.org/2001/XMLSchema-instance"
xsi:schemaLocation="invar.rule rule.xsd"
xmlns:tns="invar.rule">

  <struct name="Conflict" doc="名字冲突的类型">
    <field name="key" type="Gender" doc=""/>
    <field name="text" type="String" doc=""/>
    <field name="bytes" type="Vec-Int8" doc=""/>
  </struct>
  
  <enum name="Gender" doc="性别的枚举类型">
    <option name="NONE" value="-1" doc=""/>
    <option name="MALE" value="10" doc="Enum male"/>
    <option name="FEMALE" value="20" doc="Enum female"/>
  </enum>
  
  <struct name="Custom" doc="自定义类型">
  	<field name="x" type="Gender" doc="枚举值"/>
    <field name="test" type="TestBasic" doc="其他类型"/>
  	<field name="xyz" type="test.xyz::Conflict" doc="同名的类型"/>
  	<field name="abc" type="test.abc::Conflict" doc="同名的类型"/>
    <field name="children" type="Vec-Custom" doc="自身类型容器"/>
    <field name="noSetter" type="Int32" doc="屏蔽Setter" nosetter="true" deprecated="true"/>
    <field name="useRef" type="Int32" doc="使用引用" useref="true"/>
    <field name="usePtr" type="Int32" doc="使用指针" useptr="true"/>
    <field name="prev" type="Custom" doc="自身类型"/>
    <field name="next" type="Custom" doc="自身类型"/>
  </struct>
  
  <struct name="TestBasic" doc="基础类型">
  	<field name="numberi08" type="Int8" doc="有符号的8位整数"/>
    <field name="numberi16" type="Int16" doc="有符号的16位整数"/>
    <field name="numberi32" type="Int32" value="123" doc="有符号的32位整数"/>
    <field name="numberi64" type="Int64" doc="有符号的64位整数"/>
    <field name="numberu08" type="Uint8" doc="无符号的8位整数"/>
    <field name="numberu16" type="Uint16" doc="无符号的16位整数"/>
    <field name="numberu32" type="Uint32" doc="无符号的32位整数"/>
    <field name="numberu64" type="Uint64" doc="无符号的64位整数"/>
    <field name="numberSingle" type="Float" value="3.14" doc="单精度浮点小数"/>
    <field name="numberDouble" type="Double" doc="双精度浮点小数"/>
    <field name="boolValue" type="Bool" doc="布尔值"/>
    <field name="stringValue" type="String" value="hello" doc="字符串"/>
    <field name="enumValue" type="Gender" doc="枚举值"/>
    <field name="enumDeft" type="Gender" doc="枚举值制定默认值" value="Gender.MALE"/>
  </struct>
  
  <protoc name="TestProtoc" doc="">
    <server>
      <field name="info" type="Info" doc=""/>
    </server>
    <client>
      <field name="gender" type="Gender" doc=""/>
      <field name="info" type="Info" doc=""/>
      <field name="message" type="String" doc=""/>
    </client>
  </protoc>

  <struct name="Info" short="f" doc="Test comments">
    <field name="key" value="123" type="Int32" doc=""/>
    <field name="number01" type="Int8" doc=""/>
    <field name="number02" type="Int16" doc=""/>
    <field name="number03" type="Int32" doc=""/>
    <field name="number04" type="Int64" doc="Test field comments"/>
    <field name="number05" type="Uint8" doc=""/>
    <field name="number06" type="Uint16" doc=""/>
    <field name="number07" type="Uint32" doc=""/>
    <field name="number08" type="Uint64" doc=""/>
    <field name="number09" type="Float" doc=""/>
    <field name="number10" type="Double" doc=""/>
    <field name="isReal" type="Bool" doc=""/>
    <field name="s" type="String" value="hello" scope="public" doc="a string"/>
    <field name="world" type="Vec-String" doc=""/>
    <field name="gender" type="Gender" doc=""/>
    <field name="next" type="Info" doc=""/>
    <field name="conflict" type="test.abc::Conflict" doc=""/>
    <field name="conflicts" type="Vec-test.xyz::Conflict" doc=""/>
    <field name="numbers" type="Vec-Double" doc=""/>    
    <field name="mapInfoG" type="Map-Info-Gender" doc=""/>
    <field name="mapGenderInfo" type="Map-Gender-Info" doc=""/>
    <field name="mapDouble" type="Map-Double" doc=""/>
    <!-- 
    <field name="mapDouble2" type="Map(Int32,Vec(Info))" doc=""/>
    -->
  </struct>
</tns:package>